{
  "schema_version": 1,
  "database": "crowdwatch.sqlite",
  "regions": [
    {
      "id": "sample-area",
      "name": "Historical synthetic counter example",
      "latitude": 51.5,
      "longitude": -0.12,
      "radius_km": 0.5
    }
  ],
  "sources": [
    {
      "id": "sample-counter",
      "kind": "canonical_json",
      "region_id": "sample-area",
      "attribution": "Invented example for contract demonstration",
      "independence_group": "sample-counter",
      "ttl_seconds": 900,
      "options": {
        "path": "observations.jsonl"
      }
    }
  ]
}
